{
  "$schema": "schemas/catverter-catalog-v1.schema.json",
  "documentType": "catverter-catalog",
  "schemaVersion": 1,
  "repositoryId": "io.github.namireki.catverter.packs",
  "version": "2.2.0",
  "minimumAppVersion": "1.1.0",
  "contentBaseUrl": "https://raw.githubusercontent.com/namireki/catverter-packs/{revision}/",
  "sourceCatalog": {
    "repository": "https://github.com/namireki/CatverterV2",
    "revision": "6dd430bfda08211d27aa7212526567f186d70004",
    "file": "packs/catalog.json",
    "repositoryId": "com.namirekistudio.catverter.packs",
    "version": "1.7.0"
  },
  "packs": [
    {
      "packageId": "com.namirekistudio.catverter.pack.animals",
      "id": "animals",
      "version": "1.5.0",
      "classification": "official",
      "maintainer": "namireki",
      "file": "packs/namireki/animals.json",
      "sha256": "d8b453e4be2348ba1d925d791371819e3f0f7e6eb6c5e8b85d58996c759a1678",
      "source": {
        "repository": "https://github.com/namireki/CatverterV2",
        "revision": "6dd430bfda08211d27aa7212526567f186d70004",
        "file": "packs/namireki/animals.json",
        "sha256": "5cfefcf8593fc9325af7e85f76be357a48f9355e7faf1b16eef551e319a1b91f"
      }
    },
    {
      "packageId": "com.namirekistudio.catverter.pack.household-items",
      "id": "household-items",
      "version": "1.5.0",
      "classification": "official",
      "maintainer": "namireki",
      "file": "packs/namireki/household-items.json",
      "sha256": "b10846ea52537fd89cbe70226bf512b6f309d74434fa2c9a7fccde70c662e32a",
      "source": {
        "repository": "https://github.com/namireki/CatverterV2",
        "revision": "6dd430bfda08211d27aa7212526567f186d70004",
        "file": "packs/namireki/household-items.json",
        "sha256": "b46efe9258f73acccdf79769e6a424872c5fce38c3f1e36be3948bc90b4fb03f"
      }
    },
    {
      "packageId": "com.namirekistudio.catverter.pack.astronomy",
      "id": "astronomy",
      "version": "1.5.0",
      "classification": "official",
      "maintainer": "namireki",
      "file": "packs/namireki/astronomy.json",
      "sha256": "4ea04b0c2c5eced64ee69600d0ecc634786a859519f4ba7f2decb1d6f003cb3b",
      "source": {
        "repository": "https://github.com/namireki/CatverterV2",
        "revision": "6dd430bfda08211d27aa7212526567f186d70004",
        "file": "packs/namireki/astronomy.json",
        "sha256": "6e29f7e06bdee98ef661186c43cc1d4cabec90608cea4b1613da48cc8d25f751"
      }
    },
    {
      "packageId": "com.namirekistudio.catverter.pack.big-stuff",
      "id": "big-stuff",
      "version": "1.5.0",
      "classification": "official",
      "maintainer": "namireki",
      "file": "packs/namireki/big-stuff.json",
      "sha256": "3d14ed557022c868d56969a23b63206ebeace4cc5b09de814de08a8af75259a3",
      "source": {
        "repository": "https://github.com/namireki/CatverterV2",
        "revision": "6dd430bfda08211d27aa7212526567f186d70004",
        "file": "packs/namireki/big-stuff.json",
        "sha256": "01a7a6e19a7a57d97f98280d28862558ae27de76995d1807f8c02283777c7895"
      }
    },
    {
      "packageId": "com.namirekistudio.catverter.pack.cats",
      "id": "cats",
      "version": "1.5.0",
      "classification": "official",
      "maintainer": "namireki",
      "file": "packs/namireki/cats.json",
      "sha256": "bb5ddc09add2a371b9ed6aeb0172b6b8699b784f6e6df138365a909bae21351a",
      "source": {
        "repository": "https://github.com/namireki/CatverterV2",
        "revision": "6dd430bfda08211d27aa7212526567f186d70004",
        "file": "packs/namireki/cats.json",
        "sha256": "69ab1acb60a670f0df6324f701155cc00a80fb4c6f1534938e1d9386ea63d0a8"
      }
    },
    {
      "packageId": "com.namirekistudio.catverter.pack.food-and-drink",
      "id": "food-and-drink",
      "version": "1.5.0",
      "classification": "official",
      "maintainer": "namireki",
      "file": "packs/namireki/food-and-drink.json",
      "sha256": "bc934acbafa85ec76d84dae401cc7d23eecb3e9d64ab1a330120be8a22c0e6b6",
      "source": {
        "repository": "https://github.com/namireki/CatverterV2",
        "revision": "6dd430bfda08211d27aa7212526567f186d70004",
        "file": "packs/namireki/food-and-drink.json",
        "sha256": "ec1143752c4fa6314a337f5d5c705f35ab9a51ca7f437ba12938f95584002a59"
      }
    },
    {
      "packageId": "com.namirekistudio.catverter.pack.transport",
      "id": "transport",
      "version": "1.5.0",
      "classification": "official",
      "maintainer": "namireki",
      "file": "packs/namireki/transport.json",
      "sha256": "1eaa200ccf03808646aaadc2c24ae514f40f90288c30a668cd2a59a660d0237b",
      "source": {
        "repository": "https://github.com/namireki/CatverterV2",
        "revision": "6dd430bfda08211d27aa7212526567f186d70004",
        "file": "packs/namireki/transport.json",
        "sha256": "ed7362c99fa69803bdcac54658695a4db04bb8d6eb68ee57fe936e82a126f9ec"
      }
    },
    {
      "packageId": "com.namirekistudio.catverter.pack.sports-and-games",
      "id": "sports-and-games",
      "version": "1.5.0",
      "classification": "official",
      "maintainer": "namireki",
      "file": "packs/namireki/sports-and-games.json",
      "sha256": "cab34e443a7b59423f1c5e520df4060889b170e3bf1c79764a0aa9ec7a2c6b52",
      "source": {
        "repository": "https://github.com/namireki/CatverterV2",
        "revision": "6dd430bfda08211d27aa7212526567f186d70004",
        "file": "packs/namireki/sports-and-games.json",
        "sha256": "57cc096132aaee1b40548015c278bbf4f063c063483c4dd6d5c8bea2e7665136"
      }
    },
    {
      "packageId": "com.namirekistudio.catverter.pack.technology",
      "id": "technology",
      "version": "1.5.0",
      "classification": "official",
      "maintainer": "namireki",
      "file": "packs/namireki/technology.json",
      "sha256": "add228cb616b04410d7e86f4064cc426cc75de2a778dc26c9375832909e6089b",
      "source": {
        "repository": "https://github.com/namireki/CatverterV2",
        "revision": "6dd430bfda08211d27aa7212526567f186d70004",
        "file": "packs/namireki/technology.json",
        "sha256": "b0cbcb186fa09e9702fd8407ae7ffb62ac9afa027cb6f73df9feda9ca55d6cb4"
      }
    },
    {
      "packageId": "com.namirekistudio.catverter.pack.nature-and-weather",
      "id": "nature-and-weather",
      "version": "1.5.0",
      "classification": "official",
      "maintainer": "namireki",
      "file": "packs/namireki/nature-and-weather.json",
      "sha256": "fae0dafa6beebf8a91a84acf8a5543d843fdcd6d616f1374a1410762532e27b0",
      "source": {
        "repository": "https://github.com/namireki/CatverterV2",
        "revision": "6dd430bfda08211d27aa7212526567f186d70004",
        "file": "packs/namireki/nature-and-weather.json",
        "sha256": "b95920ab09048e475d95844d210098c34e99921c1976fb743b43eca483f18f3c"
      }
    },
    {
      "packageId": "com.namirekistudio.catverter.pack.unconventional-units",
      "id": "unconventional-units",
      "version": "1.1.0",
      "classification": "official",
      "maintainer": "namireki",
      "file": "packs/namireki/unconventional-units.json",
      "sha256": "3f7f4a786872e209dc7208e097429995efe7d359654c6d22d3284f012688b416",
      "source": {
        "repository": "https://github.com/namireki/CatverterV2",
        "revision": "6dd430bfda08211d27aa7212526567f186d70004",
        "file": "packs/namireki/unconventional-units.json",
        "sha256": "322c496b1a2b907e22bc231a13f2b8422df2f8357009fc74ec375b264acfeead"
      }
    },
    {
      "packageId": "io.github.namireki.catverter.pack.office-life",
      "id": "office-life",
      "version": "1.1.0",
      "classification": "contributed",
      "maintainer": "namireki",
      "file": "packs/namireki/office-life.json",
      "sha256": "9bdceaa73cd4424d15e585317107514b5ac5ac2c99e9ef783b90dc394633ad6a"
    }
  ],
  "locales": [
    {
      "locale": "fr",
      "name": "Français",
      "file": "locales/fr.json",
      "sha256": "55a7b5a78dd2de426a18dfd06ae8344f27c83c3b8cb4a92f4f45024cf1ea32c7",
      "source": {
        "repository": "https://github.com/namireki/CatverterV2",
        "revision": "761d910d3d2b6af52500d28f6d4a35fd75e68fe8",
        "file": "packs/locales/fr.json",
        "sha256": "aacdbb8d84a374dc85d9702dcceca6e121ca36cc7d1bd39a27f877b8996a7a94"
      }
    },
    {
      "locale": "it",
      "name": "Italiano",
      "file": "locales/it.json",
      "sha256": "589d161d5f8b3983ea634dbaa752258dedbd12450dde4c3b1c978db5a45b6b91",
      "source": {
        "repository": "https://github.com/namireki/CatverterV2",
        "revision": "6dd430bfda08211d27aa7212526567f186d70004",
        "file": "packs/locales/it.json",
        "sha256": "4b2224cab731a5e40b6c0e9fcb9140e7560d9f54ecb76f8159558b1a690007e2"
      }
    }
  ]
}
